breadcrumbs,image_url,brand,product_name,listing_price,offer_price,discount,product_id,sizes,description,other_images
"Men,Dolce&Gabbana,Shoes,Sneakers,Designer sneakers",https://img.mytheresa.com/1088/1088/66/jpeg/catalog/product/a0/P00667243.jpg,Dolce&Gabbana,New Roma leather sneakers,€ 490,,,P00667243,"EU_ 40,EU_ 41,EU_ 42,EU_ 43,EU_ 44,EU_ 45,EU_ 46","Dolce&Gabbana's New Roma sneakers fuse two of the house's iconic trainer silhouettes: the Roma and Miami styles. In a low-top design that's inspired by basketball sneakers, they're made from topstitched calfskin leather with red piping.upper: leather lining: fabric sole: leather insole, rubber sole round toe lace-up Made in Italy comes with dust bag  comes with a box Designer colour name: Bianco Nat/Lampone  True to size Half sizes please take the next size up European sizes","//img.mytheresa.com/1088/1088/66/jpeg/catalog/product/a0/P00667243_b1.jpg,//img.mytheresa.com/1088/1088/66/jpeg/catalog/product/a0/P00667243_b2.jpg,//img.mytheresa.com/1088/1088/66/jpeg/catalog/product/a0/P00667243_d1.jpg,//img.mytheresa.com/1088/1088/66/jpeg/catalog/product/a0/P00667243_d2.jpg,//img.mytheresa.com/1088/1088/66/jpeg/catalog/product/a0/P00667243_d3.jpg,//img.mytheresa.com/1088/1088/66/jpeg/catalog/product/a0/P00667243_d4.jpg"
"Men,Moncler,Shoes,Boots,Chelsea boots",https://img.mytheresa.com/1088/1088/66/jpeg/catalog/product/7e/P00709242.jpg,Moncler,Neue leather Chelsea boots,€ 529,,,P00709242,"EU_ 40,EU_ 41,EU_ 42,EU_ 43,EU_ 44,EU_ 45,EU_ 46","The Neue Chelsea boots from Moncler are a hard-wearing style for fall and winter. They're made in Italy from smooth leather with a treaded rubber outsole.upper: leather lining: fabric trim: fabric sole: leather insole, rubber sole round toe elasticated sides Made in Italy comes with dust bags comes with a box Designer colour name: Black True to size Half sizes please take the next size up European sizes 6,5cm-2.5"" heel (size EU 42)  ","//img.mytheresa.com/1088/1088/66/jpeg/catalog/product/7e/P00709242_b1.jpg,//img.mytheresa.com/1088/1088/66/jpeg/catalog/product/7e/P00709242_b2.jpg,//img.mytheresa.com/1088/1088/66/jpeg/catalog/product/7e/P00709242_d1.jpg,//img.mytheresa.com/1088/1088/66/jpeg/catalog/product/7e/P00709242_d2.jpg,//img.mytheresa.com/1088/1088/66/jpeg/catalog/product/7e/P00709242_d3.jpg,//img.mytheresa.com/1088/1088/66/jpeg/catalog/product/7e/P00709242_d4.jpg"
"Men,Brunello Cucinelli,Shoes,Boots,Lace up boots",https://img.mytheresa.com/1088/1088/66/jpeg/catalog/product/44/P00681136.jpg,Brunello Cucinelli,Shearling-lined leather lace-up boots,"€ 1,009",,,P00681136,"EU_ 39,EU_ 40,EU_ 40.5,EU_ 41,EU_ 41.5,EU_ 42,EU_ 42.5,EU_ 43,EU_ 44,EU_ 45,EU_ 46","Ground your cold-weather looks with these lace-up boots from Brunello Cucinelli. Crafted in Italy from exquisite grained leather, they feature cozy shearling lining and practical lug soles.upper: deer leather lining: shearling sole: leather insole, rubber sole round toe lace-up Made in Italy comes with extra laces comes with dust bags comes with a box Designer colour name: Brown True to size European sizes","//img.mytheresa.com/1088/1088/66/jpeg/catalog/product/44/P00681136_b1.jpg,//img.mytheresa.com/1088/1088/66/jpeg/catalog/product/44/P00681136_b2.jpg,//img.mytheresa.com/1088/1088/66/jpeg/catalog/product/44/P00681136_d1.jpg,//img.mytheresa.com/1088/1088/66/jpeg/catalog/product/44/P00681136_d2.jpg,//img.mytheresa.com/1088/1088/66/jpeg/catalog/product/44/P00681136_d3.jpg,//img.mytheresa.com/1088/1088/66/jpeg/catalog/product/44/P00681136_d4.jpg"
"Men,Gucci,Shoes,Sneakers,Low-Top",https://img.mytheresa.com/1088/1088/66/jpeg/catalog/product/22/P00613467.jpg,Gucci,Printed mesh sneakers,€ 609,,,P00613467,"UK_ 6,EU 40,UK_ 7,EU 41,UK_ 8,EU 42,UK_ 9,EU 43,UK_ 10,EU 44,UK_ 11,EU 45,UK_ 12,EU 46,UK_ 13,EU 47","These sneakers from Gucci are made from logo-printed mesh. Set on rubber soles that ensure a confident stride, they have lace-up front and pull tabs at the heels.True to size Half sizes please take the next size up UK sizes","//img.mytheresa.com/1088/1088/66/jpeg/catalog/product/22/P00613467_b1.jpg,//img.mytheresa.com/1088/1088/66/jpeg/catalog/product/22/P00613467_b2.jpg,//img.mytheresa.com/1088/1088/66/jpeg/catalog/product/22/P00613467_d1.jpg,//img.mytheresa.com/1088/1088/66/jpeg/catalog/product/22/P00613467_d2.jpg,//img.mytheresa.com/1088/1088/66/jpeg/catalog/product/22/P00613467_d3.jpg,//img.mytheresa.com/1088/1088/66/jpeg/catalog/product/22/P00613467_d4.jpg"
"Men,Gucci,Shoes,Sandals & slides",https://img.mytheresa.com/1088/1088/66/jpeg/catalog/product/d3/P00583957.jpg,Gucci,GG Supreme canvas sandals,€ 499,,,P00583957,"UK_ 5,EU 39,UK_ 6,EU 40,UK_ 7,EU 41,UK_ 8,EU 42,UK_ 9,EU 43,UK_ 10,EU 44,UK_ 11,EU 45,UK_ 12,EU 46,UK_ 13,EU 47","Detailed with Gucci's iconic GG monogram, these comfortable sandals have a double-strap construction with adjustable straps and sit atop contrast rubber soles.upper: fabric lining: leather trim: leather sole: fabric insole, rubber sole round open toe buckle fastening Made in Italy Designer colour name: Beige Ebony/L.Brown True to size Half sizes please take the next size up UK sizes","//img.mytheresa.com/1088/1088/66/jpeg/catalog/product/d3/P00583957_b1.jpg,//img.mytheresa.com/1088/1088/66/jpeg/catalog/product/d3/P00583957_b2.jpg,//img.mytheresa.com/1088/1088/66/jpeg/catalog/product/d3/P00583957_d1.jpg,//img.mytheresa.com/1088/1088/66/jpeg/catalog/product/d3/P00583957_d2.jpg,//img.mytheresa.com/1088/1088/66/jpeg/catalog/product/d3/P00583957_d3.jpg,//img.mytheresa.com/1088/1088/66/jpeg/catalog/product/d3/P00583957_d4.jpg"
"Men,John Lobb,Shoes,Sneakers,Designer sneakers",https://img.mytheresa.com/1088/1088/66/jpeg/catalog/product/04/P00699509.jpg,John Lobb,Molton leather sneakers,€ 585,,,P00699509,"UK_ 6,EU 40,UK_ 6.5,EU 40,5,UK_ 7,EU 41,UK_ 7.5,EU 41,5,UK_ 8,EU 42,UK_ 8.5,EU 42,5,UK_ 9,EU 43,UK_ 9.5,EU 43,5,UK_ 10,EU 44,UK_ 10.5,EU 44,5,UK_ 11,EU 45,UK_ 12,EU 46","John Lobb's Molton sneakers are made from dark green suede  and have a classic low-top silhouette. Set on rubber soles, they have lace-up fronts and round toes.upper: cow leather sole: leather insole, rubber sole round toe lace-up Made in Italy comes with extra laces comes with a box comes with dust bags Designer colour name: Dark olive Fits slightly small to size - we recommend trying a half size larger UK sizes","//img.mytheresa.com/1088/1088/66/jpeg/catalog/product/04/P00699509_b1.jpg,//img.mytheresa.com/1088/1088/66/jpeg/catalog/product/04/P00699509_b2.jpg,//img.mytheresa.com/1088/1088/66/jpeg/catalog/product/04/P00699509_d1.jpg,//img.mytheresa.com/1088/1088/66/jpeg/catalog/product/04/P00699509_d2.jpg,//img.mytheresa.com/1088/1088/66/jpeg/catalog/product/04/P00699509_d3.jpg,//img.mytheresa.com/1088/1088/66/jpeg/catalog/product/04/P00699509_d4.jpg"
"Men,Balenciaga,Shoes,Sandals & slides",https://img.mytheresa.com/1088/1088/66/jpeg/catalog/product/eb/P00655745.jpg,Balenciaga,Pool logo rubber slides,€ 350,,,P00655745,"EU_ 39,EU_ 40,EU_ 41,EU_ 42,EU_ 43,EU_ 44,EU_ 45,EU_ 46,EU_ 47","With a molded footbed for added comfort, these blue and black rubber pool slides from Balenciaga have a slip-on design with the logo in black.upper: rubber lining: rubber sole: rubber insole and sole round open toe Made in Italy comes with dust bags, comes with a box Designer colour name: Blue/Black/Black True to size Half sizes please take the next size up European sizes","//img.mytheresa.com/1088/1088/66/jpeg/catalog/product/eb/P00655745_b2.jpg,//img.mytheresa.com/1088/1088/66/jpeg/catalog/product/eb/P00655745_d1.jpg,//img.mytheresa.com/1088/1088/66/jpeg/catalog/product/eb/P00655745_d2.jpg,//img.mytheresa.com/1088/1088/66/jpeg/catalog/product/eb/P00655745_d3.jpg,//img.mytheresa.com/1088/1088/66/jpeg/catalog/product/eb/P00655745_d4.jpg"
"Men,Balenciaga,Shoes,Sandals & slides",https://img.mytheresa.com/1088/1088/66/jpeg/catalog/product/6c/P00655676.jpg,Balenciaga,Pool Crocs™ rubber sandals,€ 450,,,P00655676,"EU_ 39,EU_ 40,EU_ 41,EU_ 42,EU_ 43,EU_ 44,EU_ 45,EU_ 46","In collaboration with Crocs™, these black slide sandals from Balenciaga are made with gripped rubber soles in an open-toed style. A slight heel and logo-embossed uppers complete the design.upper: rubber lining: rubber sole: rubber insole and sole round open toe Made in China comes with dust bags comes with a box Designer colour name: Black Fits large to size - we recommend trying one size smaller European sizes 7,0cm-3"" heel (size EU 42)  ","//img.mytheresa.com/1088/1088/66/jpeg/catalog/product/6c/P00655676_b1.jpg,//img.mytheresa.com/1088/1088/66/jpeg/catalog/product/6c/P00655676_b2.jpg,//img.mytheresa.com/1088/1088/66/jpeg/catalog/product/6c/P00655676_d1.jpg,//img.mytheresa.com/1088/1088/66/jpeg/catalog/product/6c/P00655676_d2.jpg,//img.mytheresa.com/1088/1088/66/jpeg/catalog/product/6c/P00655676_d3.jpg,//img.mytheresa.com/1088/1088/66/jpeg/catalog/product/6c/P00655676_d4.jpg"
"Men,Burberry,Shoes,Espadrilles",https://img.mytheresa.com/1088/1088/66/jpeg/catalog/product/75/P00623713.jpg,Burberry,Checked espadrilles,€ 355,,,P00623713,"EU_ 39,EU_ 40,EU_ 41,EU_ 42,EU_ 43,EU_ 44,EU_ 45,EU_ 46","Featuring Burberry's signature check motif, these comfortable espadrilles come in birch brown, sporting fabric uppers, a roped trim, and smooth rubber soles.upper: calf leather, fabric lining: leather, fabric sole: fabric insole, rubber sole round toe Made in Spain comes with a box comes with dust bag  Designer colour name: Birch Brown Check True to size Half sizes please take the next size up European sizes","//img.mytheresa.com/1088/1088/66/jpeg/catalog/product/75/P00623713_b1.jpg,//img.mytheresa.com/1088/1088/66/jpeg/catalog/product/75/P00623713_b2.jpg,//img.mytheresa.com/1088/1088/66/jpeg/catalog/product/75/P00623713_d1.jpg,//img.mytheresa.com/1088/1088/66/jpeg/catalog/product/75/P00623713_d2.jpg,//img.mytheresa.com/1088/1088/66/jpeg/catalog/product/75/P00623713_d3.jpg,//img.mytheresa.com/1088/1088/66/jpeg/catalog/product/75/P00623713_d4.jpg"
"Men,Balenciaga,Shoes,Sneakers,Designer sneakers",https://img.mytheresa.com/1088/1088/66/jpeg/catalog/product/1a/P00655761.jpg,Balenciaga,Phantom sneakers,€ 695,,,P00655761,"EU_ 39,EU_ 40,EU_ 41,EU_ 42,EU_ 43,EU_ 44","Balenciaga's Phantom sneakers are made from breathable mesh with logo detailing. Made in Italy, they have lace-up fronts and rounded toes.upper: fabric lining: fabric sole: fabric insole, rubber sole round toe lace-up Made in Italy comes with dust bag  comes with a box Designer colour name: Lime/Black True to size Half sizes please take the next size down European sizes","//img.mytheresa.com/1088/1088/66/jpeg/catalog/product/1a/P00655761_b1.jpg,//img.mytheresa.com/1088/1088/66/jpeg/catalog/product/1a/P00655761_b2.jpg,//img.mytheresa.com/1088/1088/66/jpeg/catalog/product/1a/P00655761_d1.jpg,//img.mytheresa.com/1088/1088/66/jpeg/catalog/product/1a/P00655761_d2.jpg,//img.mytheresa.com/1088/1088/66/jpeg/catalog/product/1a/P00655761_d3.jpg,//img.mytheresa.com/1088/1088/66/jpeg/catalog/product/1a/P00655761_d4.jpg"
"Men,Zegna,Shoes,Espadrilles",https://img.mytheresa.com/1088/1088/66/jpeg/catalog/product/f4/P00609670.jpg,Zegna,Valencia suede espadrilles,€ 465,,,P00609670,"UK_ 6,EU 40,UK_ 7,EU 41,UK_ 8,EU 42,UK_ 9,EU 43,UK_ 10,EU 44,UK_ 11,EU 45,UK_ 12,EU 46,UK_ 13,EU 47","Ermenegildo Zegna's Valencia espadrilles are made from soft suede and set on classic woven jute soles.upper: calf leather lining: leather trim: jute sole: leather insole, rubber sole round toe Made in Portugal comes with dust bags comes with a box Designer colour name: Md Grn Sld  Fits small to size - we recommend trying one size larger UK sizes","//img.mytheresa.com/1088/1088/66/jpeg/catalog/product/f4/P00609670_b1.jpg,//img.mytheresa.com/1088/1088/66/jpeg/catalog/product/f4/P00609670_b2.jpg,//img.mytheresa.com/1088/1088/66/jpeg/catalog/product/f4/P00609670_d1.jpg,//img.mytheresa.com/1088/1088/66/jpeg/catalog/product/f4/P00609670_d2.jpg,//img.mytheresa.com/1088/1088/66/jpeg/catalog/product/f4/P00609670_d3.jpg,//img.mytheresa.com/1088/1088/66/jpeg/catalog/product/f4/P00609670_d4.jpg"
"Men,Berluti,Shoes,Sneakers,Low-Top",https://img.mytheresa.com/1088/1088/66/jpeg/catalog/product/20/P00643021.jpg,Berluti,Playtime leather sneakers,"€ 1,345",,,P00643021,"UK_ 5,EU 39,UK_ 6,EU 40,UK_ 7,EU 41,UK_ 8,EU 42,UK_ 9,EU 43,UK_ 10,EU 44,UK_ 11,EU 45,UK_ 12,EU 46","Made in Italy, these sleek sneakers from Berluti are crafted in burnished leather, feature lace-up fronts, and rest on vulcanized rubber soles.upper: calf leather lining: leather sole: leather insole, rubber sole round toe lace-up Made in Italy comes with dust bag  comes with a box Designer colour name: Cacao Intenso  True to size Half sizes please take the next size down UK sizes","//img.mytheresa.com/1088/1088/66/jpeg/catalog/product/20/P00643021_b1.jpg,//img.mytheresa.com/1088/1088/66/jpeg/catalog/product/20/P00643021_b2.jpg,//img.mytheresa.com/1088/1088/66/jpeg/catalog/product/20/P00643021_d1.jpg,//img.mytheresa.com/1088/1088/66/jpeg/catalog/product/20/P00643021_d2.jpg,//img.mytheresa.com/1088/1088/66/jpeg/catalog/product/20/P00643021_d3.jpg,//img.mytheresa.com/1088/1088/66/jpeg/catalog/product/20/P00643021_d4.jpg"
"Men,Versace,Shoes,Loafers",https://img.mytheresa.com/1088/1088/66/jpeg/catalog/product/bf/P00680505.jpg,Versace,Medusa Chain leather loafers,€ 665,,,P00680505,"EU_ 39,EU_ 40,EU_ 41,EU_ 42,EU_ 43,EU_ 44,EU_ 45,EU_ 46,EU_ 47","These loafers from Versace are adorned with Medusa Chain hardware. Made in Italy from brushed leather, they have soft heel counters that can be folded down so that they can be worn as slippers.upper: calf leather lining: leather sole: leather insole and sole round toe Made in Italy comes with dust bag  comes with a box Designer colour name: Nero-Oro Versace Fits large to size - we recommend trying one size smaller European sizes","//img.mytheresa.com/1088/1088/66/jpeg/catalog/product/bf/P00680505_b1.jpg,//img.mytheresa.com/1088/1088/66/jpeg/catalog/product/bf/P00680505_b2.jpg,//img.mytheresa.com/1088/1088/66/jpeg/catalog/product/bf/P00680505_d1.jpg,//img.mytheresa.com/1088/1088/66/jpeg/catalog/product/bf/P00680505_d2.jpg,//img.mytheresa.com/1088/1088/66/jpeg/catalog/product/bf/P00680505_d3.jpg,//img.mytheresa.com/1088/1088/66/jpeg/catalog/product/bf/P00680505_d4.jpg"
"Men,Berluti,Shoes,Sneakers,Low-Top",https://img.mytheresa.com/1088/1088/66/jpeg/catalog/product/85/P00643022.jpg,Berluti,Fast Track suede and nylon sneakers,"€ 1,180",,,P00643022,"UK_ 5,EU 39,UK_ 6,EU 40,UK_ 7,EU 41,UK_ 8,EU 42,UK_ 9,EU 43,UK_ 10,EU 44,UK_ 11,EU 45,UK_ 12,EU 46","Green suede uppers lasered with the brand's Scritto motif define this iteration of Berluti's Fast Track sneakers. These sneakers are lined in nylon mesh and their padded heel counters and rubber soles provide enhanced comfort.upper: calf leather lining: fabric trim: fabric sole: fabric insole, rubber sole round toe lace-up Made in Italy comes with extra laces comes with dust bag  comes with a box Designer colour name: Green True to size Half sizes please take the next size down UK sizes","//img.mytheresa.com/1088/1088/66/jpeg/catalog/product/85/P00643022_b1.jpg,//img.mytheresa.com/1088/1088/66/jpeg/catalog/product/85/P00643022_b2.jpg,//img.mytheresa.com/1088/1088/66/jpeg/catalog/product/85/P00643022_d1.jpg,//img.mytheresa.com/1088/1088/66/jpeg/catalog/product/85/P00643022_d2.jpg,//img.mytheresa.com/1088/1088/66/jpeg/catalog/product/85/P00643022_d3.jpg,//img.mytheresa.com/1088/1088/66/jpeg/catalog/product/85/P00643022_d4.jpg"
"Men,Golden Goose,Shoes,Sneakers,Designer sneakers",https://img.mytheresa.com/1088/1088/66/jpeg/catalog/product/09/P00454110.jpg,Golden Goose,Distressed Superstar sneakers,€ 335,,,P00454110,"EU_ 39,EU_ 40,EU_ 41,EU_ 42,EU_ 43,EU_ 44,EU_ 45,EU_ 46,EU_ 47","Finished with a distressed look, these white low-top sneakers from Golden Goose are made in Italy from leather and feature printed laces, a logo-print heel counter and a leather gold star on the side.upper: leather lining: leather sole: leather insole, rubber sole round toe lace-up Made in Italy Designer colour name: White Gold  True to size Half sizes please take the next size down European sizes","//img.mytheresa.com/1088/1088/66/jpeg/catalog/product/09/P00454110_b1.jpg,//img.mytheresa.com/1088/1088/66/jpeg/catalog/product/09/P00454110_b2.jpg,//img.mytheresa.com/1088/1088/66/jpeg/catalog/product/09/P00454110_d1.jpg,//img.mytheresa.com/1088/1088/66/jpeg/catalog/product/09/P00454110_d2.jpg,//img.mytheresa.com/1088/1088/66/jpeg/catalog/product/09/P00454110_d3.jpg"
"Men,Salomon,Shoes,Sneakers,Low-Top",https://img.mytheresa.com/1088/1088/66/jpeg/catalog/product/57/P00703568.jpg,Salomon,ACS Pro Advanced sneaker,€ 165,,,P00703568,"UK_ 6.5,EU 40,UK_ 7,EU 40 2,3,UK_ 7.5,EU 41 1,3,UK_ 8,EU 42,UK_ 8.5,EU 42 2,3,UK_ 9,EU 43 1,3,UK_ 9.5,EU 44,UK_ 10,EU 44 2,3,UK_ 10.5,EU 45 1,3,UK_ 11,EU 46,UK_ 11.5,EU 46 2,3,UK_ 12,EU 47 1,3,UK_ 12.5,EU 48","Offering a refreshed take on a legendary model from the brand's archive, Salomon's ACS Pro Advanced sneaker offers a slim, technical mesh silhouette and Contagrip® outsoles - designed for optimum traction on any terrain.upper: fabric, rubber lining: fabric sole: fabric insole, rubber sole round toe lace-up Made in China comes with a box Designer colour name: White/Vanilla Ice/Lunar Rock True to size UK sizes","//img.mytheresa.com/1088/1088/66/jpeg/catalog/product/57/P00703568_b1.jpg,//img.mytheresa.com/1088/1088/66/jpeg/catalog/product/57/P00703568_b2.jpg,//img.mytheresa.com/1088/1088/66/jpeg/catalog/product/57/P00703568_d1.jpg,//img.mytheresa.com/1088/1088/66/jpeg/catalog/product/57/P00703568_d2.jpg,//img.mytheresa.com/1088/1088/66/jpeg/catalog/product/57/P00703568_d3.jpg,//img.mytheresa.com/1088/1088/66/jpeg/catalog/product/57/P00703568_d4.jpg"
"Men,Tom Ford,Shoes,Boots,Ankle boots",https://img.mytheresa.com/1088/1088/66/jpeg/catalog/product/64/P00506772.jpg,Tom Ford,Elkan leather boots,"€ 1,200",,,P00506772,"UK_ 6,EU 39,UK_ 7,EU 40,UK_ 8,EU 41,UK_ 9,EU 42,UK_ 10,EU 43,UK_ 11,EU 44,UK_ 12,EU 45,UK_ 13,EU 46","Crafted from smooth leather, these formal ankle boots from Tom Ford have a zipped fastening, and flat leather stacked heel in black.upper: calf leather lining: leather trim: brass sole: leather insole and sole round toe zipped side Made in Italy Designer colour name: Black True to size Half sizes please take the next size up UK sizes","//img.mytheresa.com/1088/1088/66/jpeg/catalog/product/64/P00506772_b1.jpg,//img.mytheresa.com/1088/1088/66/jpeg/catalog/product/64/P00506772_b2.jpg,//img.mytheresa.com/1088/1088/66/jpeg/catalog/product/64/P00506772_d1.jpg,//img.mytheresa.com/1088/1088/66/jpeg/catalog/product/64/P00506772_d2.jpg,//img.mytheresa.com/1088/1088/66/jpeg/catalog/product/64/P00506772_d3.jpg,//img.mytheresa.com/1088/1088/66/jpeg/catalog/product/64/P00506772_d4.jpg"
"Men,New Balance,Shoes,Sneakers,Sports sneakers",https://img.mytheresa.com/1088/1088/66/jpeg/catalog/product/5d/P00662796.jpg,New Balance,550 leather sneakers,€ 109,,,P00662796,"US_ 7,EU 40,US_ 8,EU 41,5,US_ 8.5,EU 42,US_ 9,EU 42,5,US_ 9.5,EU 43,US_ 10,EU 44,US_ 10.5,EU 44,5,US_ 11,EU 45,US_ 12,EU 46,5,US_ 13,EU 47,5","The New Balance 550s are an upgraded version of a legacy design. Made with perforated leather uppers, mesh detailing, and elevated soles, these are court sneakers for a new era.upper: leather lining: fabric sole: fabric insole, rubber sole round toe lace-up Made in Vietnam comes with a box Designer colour name: Black/Sea Salt  True to size US sizes","//img.mytheresa.com/1088/1088/66/jpeg/catalog/product/5d/P00662796_b1.jpg,//img.mytheresa.com/1088/1088/66/jpeg/catalog/product/5d/P00662796_b2.jpg,//img.mytheresa.com/1088/1088/66/jpeg/catalog/product/5d/P00662796_d1.jpg,//img.mytheresa.com/1088/1088/66/jpeg/catalog/product/5d/P00662796_d2.jpg,//img.mytheresa.com/1088/1088/66/jpeg/catalog/product/5d/P00662796_d3.jpg,//img.mytheresa.com/1088/1088/66/jpeg/catalog/product/5d/P00662796_d4.jpg"
"Men,Salomon,Shoes,Sneakers,Sports sneakers",https://img.mytheresa.com/1088/1088/66/jpeg/catalog/product/b9/P00500855.jpg,Salomon,Quest 4D GTX ADV sneakers,€ 205,,,P00500855,"UK_ 6.5,EU 40,UK_ 7,EU 40 2,3,UK_ 7.5,EU 41 1,3,UK_ 8,EU 42,UK_ 8.5,EU 42 2,3,UK_ 9,EU 43 1,3,UK_ 9.5,EU 44,UK_ 10,EU 44 2,3,UK_ 10.5,EU 45 1,3,UK_ 11,EU 46,UK_ 11.5,EU 46 2,3,UK_ 12,EU 47 1,3,UK_ 12.5,EU 48","In a brown suede and fabric upper, these high-top sneakers from Salomon offer a secure fit and sturdy rubber soles for a cushioned land on tough terrains.upper: leather, fabric lining: fabric sole: fabric insole, rubber sole round toe lace-up Designer colour name: Kangaroo/ Kangaroo/ Chinchilla Fits slightly small to size - we recommend trying a half size larger UK sizes","//img.mytheresa.com/1088/1088/66/jpeg/catalog/product/b9/P00500855_b1.jpg,//img.mytheresa.com/1088/1088/66/jpeg/catalog/product/b9/P00500855_b2.jpg,//img.mytheresa.com/1088/1088/66/jpeg/catalog/product/b9/P00500855_d1.jpg,//img.mytheresa.com/1088/1088/66/jpeg/catalog/product/b9/P00500855_d2.jpg,//img.mytheresa.com/1088/1088/66/jpeg/catalog/product/b9/P00500855_d3.jpg,//img.mytheresa.com/1088/1088/66/jpeg/catalog/product/b9/P00500855_d4.jpg"
"Men,Salomon,Shoes,Sneakers,Low-Top",https://img.mytheresa.com/1088/1088/66/jpeg/catalog/product/d5/P00646842.jpg,Salomon,ACS Pro Advanced sneaker,€ 169,€ 195,,P00646842,"UK_ 5,EU 38,UK_ 6.5,EU 40,UK_ 6,EU 39 1,3,UK_ 7,EU 40 2,3,UK_ 7.5,EU 41 1,3,UK_ 8,EU 42,UK_ 8.5,EU 42 2,3,UK_ 9,EU 43 1,3,UK_ 9.5,EU 44,UK_ 10,EU 44 2,3,UK_ 10.5,EU 45 1,3,UK_ 11,EU 46,UK_ 11.5,EU 46 2,3,UK_ 12,EU 47 1,3,UK_ 12.5,EU 48","Offering a refreshed take on a legendary model from the brand's archive, Salomon's ACS Pro Advanced sneaker offers a slim, technical mesh silhouette and Contagrip® outsoles - designed for optimum traction on any terrain.upper: fabric lining: fabric sole: fabric insole, rubber sole round toe Made in China comes with a box Designer colour name: Black/Black/Black True to size UK sizes","//img.mytheresa.com/1088/1088/66/jpeg/catalog/product/d5/P00646842_b1.jpg,//img.mytheresa.com/1088/1088/66/jpeg/catalog/product/d5/P00646842_b2.jpg,//img.mytheresa.com/1088/1088/66/jpeg/catalog/product/d5/P00646842_d1.jpg,//img.mytheresa.com/1088/1088/66/jpeg/catalog/product/d5/P00646842_d2.jpg,//img.mytheresa.com/1088/1088/66/jpeg/catalog/product/d5/P00646842_d3.jpg,//img.mytheresa.com/1088/1088/66/jpeg/catalog/product/d5/P00646842_d4.jpg"
"Men,Christian Louboutin,Shoes,Sneakers,Designer sneakers",https://img.mytheresa.com/1088/1088/66/jpeg/catalog/product/9f/P00577979.jpg,Christian Louboutin,Lou Spikes Orlato sneakers,€ 669,,,P00577979,"EU_ 39,EU_ 40,EU_ 41,EU_ 42,EU_ 43,EU_ 44,EU_ 45,EU_ 46,EU_ 47","A signature style of the brand, these Lou Spikes Orlato sneakers from Christian Louboutin come in blue with leather uppers, rubber soles, and the iconic Louboutin spikes at the toe cap.upper: fabric lining: leather trim: calf leather sole: leather insole, rubber sole round toe lace-up Made in Italy Designer colour name: Vers Blu Argento/Marine Mat comes with extra laces True to size Half sizes please take the next size up European sizes","//img.mytheresa.com/1088/1088/66/jpeg/catalog/product/9f/P00577979_b1.jpg,//img.mytheresa.com/1088/1088/66/jpeg/catalog/product/9f/P00577979_b2.jpg,//img.mytheresa.com/1088/1088/66/jpeg/catalog/product/9f/P00577979_d1.jpg,//img.mytheresa.com/1088/1088/66/jpeg/catalog/product/9f/P00577979_d2.jpg,//img.mytheresa.com/1088/1088/66/jpeg/catalog/product/9f/P00577979_d3.jpg,//img.mytheresa.com/1088/1088/66/jpeg/catalog/product/9f/P00577979_d4.jpg"
"Men,Loro Piana,Shoes,Espadrilles",https://img.mytheresa.com/1088/1088/66/jpeg/catalog/product/47/P00452706.jpg,Loro Piana,Seaside Walk suede espadrilles,€ 475,,,P00452706,"EU_ 39,EU_ 40,EU_ 41,EU_ 42,EU_ 43,EU_ 44,EU_ 45,EU_ 46,EU_ 47","These beige Loro Piana espadrilles are beautifully crafted in Italy from unlined, water-repellent suede on rope soles handmade in Spain, and feature fold-down heels.upper: leather lining: leather trim: jute sole: leather and jute insole, rubber sole round toe Made in Italy Designer colour name: Classic Beige  Sole: rubber True to size Half sizes please take the next size up European sizes","//img.mytheresa.com/1088/1088/66/jpeg/catalog/product/47/P00452706_b1.jpg,//img.mytheresa.com/1088/1088/66/jpeg/catalog/product/47/P00452706_b2.jpg,//img.mytheresa.com/1088/1088/66/jpeg/catalog/product/47/P00452706_d1.jpg,//img.mytheresa.com/1088/1088/66/jpeg/catalog/product/47/P00452706_d2.jpg,//img.mytheresa.com/1088/1088/66/jpeg/catalog/product/47/P00452706_d3.jpg,//img.mytheresa.com/1088/1088/66/jpeg/catalog/product/47/P00452706_d4.jpg"
"Men,Moncler,Shoes,Boots,Lace up boots",https://img.mytheresa.com/1088/1088/66/jpeg/catalog/product/54/P00643724.jpg,Moncler,Mercurius lace-up boots,€ 419,,,P00643724,"EU_ 39,EU_ 40,EU_ 41,EU_ 42,EU_ 43,EU_ 44,EU_ 45,EU_ 46","These black hiking-inspired boots from Moncler feature canvas uppers, lace-up fronts, and thickly cleated rubber soles.upper: fabric lining: fabric sole: leather insole, rubber sole round toe lace-up Made in Italy Designer colour name: Black True to size Half sizes please take the next size down European sizes 6,5cm-2.5"" heel (size EU 42)  ","//img.mytheresa.com/1088/1088/66/jpeg/catalog/product/54/P00643724_b1.jpg,//img.mytheresa.com/1088/1088/66/jpeg/catalog/product/54/P00643724_b2.jpg,//img.mytheresa.com/1088/1088/66/jpeg/catalog/product/54/P00643724_d1.jpg,//img.mytheresa.com/1088/1088/66/jpeg/catalog/product/54/P00643724_d2.jpg,//img.mytheresa.com/1088/1088/66/jpeg/catalog/product/54/P00643724_d3.jpg,//img.mytheresa.com/1088/1088/66/jpeg/catalog/product/54/P00643724_d4.jpg"
