breadcrumbs,image_url,brand,product_name,listing_price,offer_price,discount,product_id,sizes,description,other_images
"Men,Maison Margiela,Shoes,Sneakers,Low-Top",https://img.mytheresa.com/1088/1088/66/jpeg/catalog/product/c2/P00710651.jpg,Maison Margiela,Replica Painter canvas sneakers,€ 415,,,P00710651,"EU_ 39,EU_ 40,EU_ 41,EU_ 42,EU_ 43,EU_ 44,EU_ 45,EU_ 46,EU_ 47","In a reworked version of the iconic 1998 style from Maison Margiela, these white canvas sneakers feature a low-top design and colored paint splatters at the front.upper: fabric lining: fabric sole: leather insole and sole round toe lace-up Made in Italy comes with dust bags comes with a box Designer colour name: White/Roseate True to size Half sizes please take the next size up European sizes","//img.mytheresa.com/1088/1088/66/jpeg/catalog/product/c2/P00710651_b1.jpg,//img.mytheresa.com/1088/1088/66/jpeg/catalog/product/c2/P00710651_b2.jpg,//img.mytheresa.com/1088/1088/66/jpeg/catalog/product/c2/P00710651_d1.jpg,//img.mytheresa.com/1088/1088/66/jpeg/catalog/product/c2/P00710651_d2.jpg,//img.mytheresa.com/1088/1088/66/jpeg/catalog/product/c2/P00710651_d3.jpg,//img.mytheresa.com/1088/1088/66/jpeg/catalog/product/c2/P00710651_d4.jpg"
"Men,Lemaire,Shoes,Boots,Chelsea boots",https://img.mytheresa.com/1088/1088/66/jpeg/catalog/product/a6/P00691539.jpg,Lemaire,Suede cowboy boots,€ 649,,,P00691539,"EU_ 39,EU_ 40,EU_ 41,EU_ 42,EU_ 43,EU_ 44,EU_ 45","Lemaire's suede boots have a Western-inspired silhouette with curved toplines and decorative stitching. With welted leather soles and wax-coated uppers, these boots are built to last.upper: leather lining: leather sole: leather insole and sole round toe Made in Portugal comes with dust bag  comes with a box Designer colour name: Otter Fits large to size - we recommend trying one size smaller European sizes","//img.mytheresa.com/1088/1088/66/jpeg/catalog/product/a6/P00691539_b1.jpg,//img.mytheresa.com/1088/1088/66/jpeg/catalog/product/a6/P00691539_b2.jpg,//img.mytheresa.com/1088/1088/66/jpeg/catalog/product/a6/P00691539_d1.jpg,//img.mytheresa.com/1088/1088/66/jpeg/catalog/product/a6/P00691539_d2.jpg,//img.mytheresa.com/1088/1088/66/jpeg/catalog/product/a6/P00691539_d3.jpg,//img.mytheresa.com/1088/1088/66/jpeg/catalog/product/a6/P00691539_d4.jpg"
"Men,Valentino Garavani,Shoes,Boots,Chelsea boots",https://img.mytheresa.com/1088/1088/66/jpeg/catalog/product/d5/P00675790.jpg,Valentino Garavani,Aristopunk embellished Chelsea boots,€ 825,,,P00675790,"EU_ 39,EU_ 40,EU_ 41,EU_ 42,EU_ 43,EU_ 44,EU_ 45,EU_ 46,EU_ 47","Valentino Garavani reimagines classic Chelsea boots with the Aristopunk style. It's made from smooth black leather with tonal Rockstud embellishments for a tough-luxe look.upper: calf leather lining: leather, fabric trim: platinum-plated studs sole: leather insole, rubber sole round toe elasticated sides Made in Italy comes with dust bags comes with a box Designer colour name: Nero True to size Half sizes please take the next size down European sizes","//img.mytheresa.com/1088/1088/66/jpeg/catalog/product/d5/P00675790_b1.jpg,//img.mytheresa.com/1088/1088/66/jpeg/catalog/product/d5/P00675790_b2.jpg,//img.mytheresa.com/1088/1088/66/jpeg/catalog/product/d5/P00675790_d1.jpg,//img.mytheresa.com/1088/1088/66/jpeg/catalog/product/d5/P00675790_d2.jpg,//img.mytheresa.com/1088/1088/66/jpeg/catalog/product/d5/P00675790_d3.jpg,//img.mytheresa.com/1088/1088/66/jpeg/catalog/product/d5/P00675790_d4.jpg"
"Men,Loewe,Shoes,Sneakers,Low-Top",https://img.mytheresa.com/1088/1088/66/jpeg/catalog/product/cc/P00616616.jpg,Loewe,x On Cloudventure sneakers,€ 269,,,P00616616,"EU_ 40,EU_ 41,EU_ 42,EU_ 43,EU_ 44,EU_ 45,EU_ 46","Loewe and On join forces to bring you a pair of sneakers set to take your morning runs to a new level. The orange Cloudventure is a lightweight, performance-based shoe, set on Missiongrip soles and illustrated with an exclusive Sublimation print.upper: fabric lining: fabric sole: fabric insole, rubber sole round toe lace-up Made in Vietnam comes with a box Designer colour name: Gradient Orange True to size Half sizes please take the next size up European sizes","//img.mytheresa.com/1088/1088/66/jpeg/catalog/product/cc/P00616616_b1.jpg,//img.mytheresa.com/1088/1088/66/jpeg/catalog/product/cc/P00616616_b2.jpg,//img.mytheresa.com/1088/1088/66/jpeg/catalog/product/cc/P00616616_d1.jpg,//img.mytheresa.com/1088/1088/66/jpeg/catalog/product/cc/P00616616_d2.jpg,//img.mytheresa.com/1088/1088/66/jpeg/catalog/product/cc/P00616616_d3.jpg,//img.mytheresa.com/1088/1088/66/jpeg/catalog/product/cc/P00616616_d4.jpg"
"Men,Valentino Garavani,Shoes,Sandals & slides",https://img.mytheresa.com/1088/1088/66/jpeg/catalog/product/b5/P00675843.jpg,Valentino Garavani,Roman Stud Turtle slides,€ 379,,,P00675843,"EU_ 39,EU_ 40,EU_ 41,EU_ 42,EU_ 43,EU_ 44,EU_ 45,EU_ 46,EU_ 47","Italian-crafted with rubber soles and uppers, these brown slides offer molded footbeds for added comfort. Valentino Garavani employs its signature Maxi Roman Studs in an all-over design to bold effect.upper: rubber lining: rubber sole: rubber insole and sole round open toe Made in Italy comes with dust bags comes with a box Designer colour name: Fondant Fits large to size - we recommend trying one size smaller European sizes","//img.mytheresa.com/1088/1088/66/jpeg/catalog/product/b5/P00675843_b1.jpg,//img.mytheresa.com/1088/1088/66/jpeg/catalog/product/b5/P00675843_b2.jpg,//img.mytheresa.com/1088/1088/66/jpeg/catalog/product/b5/P00675843_d1.jpg,//img.mytheresa.com/1088/1088/66/jpeg/catalog/product/b5/P00675843_d2.jpg,//img.mytheresa.com/1088/1088/66/jpeg/catalog/product/b5/P00675843_d3.jpg,//img.mytheresa.com/1088/1088/66/jpeg/catalog/product/b5/P00675843_d4.jpg"
"Men,Valentino Garavani,Shoes,Sandals & slides",https://img.mytheresa.com/1088/1088/66/jpeg/catalog/product/8b/P00675794.jpg,Valentino Garavani,Roman Stud Turtle slides,€ 379,,,P00675794,"EU_ 39,EU_ 40,EU_ 41,EU_ 42,EU_ 43,EU_ 44,EU_ 45,EU_ 46,EU_ 47","Italian-crafted with rubber soles and uppers, these black slides offer molded footbeds for added comfort. Valentino Garavani employs its signature Maxi Roman Studs in an all-over design to bold effect.upper: rubber lining: rubber sole: rubber insole and sole round open toe Made in Italy comes with dust bags comes with a box Designer colour name: Nero Fits large to size - we recommend trying one size smaller European sizes","//img.mytheresa.com/1088/1088/66/jpeg/catalog/product/8b/P00675794_b1.jpg,//img.mytheresa.com/1088/1088/66/jpeg/catalog/product/8b/P00675794_b2.jpg,//img.mytheresa.com/1088/1088/66/jpeg/catalog/product/8b/P00675794_d1.jpg,//img.mytheresa.com/1088/1088/66/jpeg/catalog/product/8b/P00675794_d2.jpg,//img.mytheresa.com/1088/1088/66/jpeg/catalog/product/8b/P00675794_d3.jpg,//img.mytheresa.com/1088/1088/66/jpeg/catalog/product/8b/P00675794_d4.jpg"
"Men,New Balance,Shoes,Sneakers,Sports sneakers",https://img.mytheresa.com/1088/1088/66/jpeg/catalog/product/74/P00662829.jpg,New Balance,2002R suede sneakers,€ 135,,,P00662829,"US_ 7,EU 40,US_ 8,EU 41,5,US_ 8.5,EU 42,US_ 9,EU 42,5,US_ 9.5,EU 43,US_ 10,EU 44,US_ 10.5,EU 44,5,US_ 11,EU 45,US_ 12,EU 46,5,US_ 13,EU 47,5","The New Balance 2002R design is a subtle nod to 2000s-era running shoes. These orange sneakers package shock-absorbing ABZORB midsoles with supportive Stability Web arches in a sleek suede design.upper: leather, fabric lining: fabric sole: fabric insole, rubber sole round toe lace-up Made in Vietnam comes with a box Designer colour name: Vintage Orange/Marigold True to size US sizes","//img.mytheresa.com/1088/1088/66/jpeg/catalog/product/74/P00662829_b1.jpg,//img.mytheresa.com/1088/1088/66/jpeg/catalog/product/74/P00662829_b2.jpg,//img.mytheresa.com/1088/1088/66/jpeg/catalog/product/74/P00662829_d1.jpg,//img.mytheresa.com/1088/1088/66/jpeg/catalog/product/74/P00662829_d2.jpg,//img.mytheresa.com/1088/1088/66/jpeg/catalog/product/74/P00662829_d3.jpg,//img.mytheresa.com/1088/1088/66/jpeg/catalog/product/74/P00662829_d4.jpg"
"Men,On,Shoes,Sneakers,Sports sneakers",https://img.mytheresa.com/1088/1088/66/jpeg/catalog/product/90/P00704327.jpg,On,Cloud 5 running shoes,€ 135,,,P00704327,"US_ 7,EU 40,US_ 8,EU 41,US_ 9,EU 42,5,US_ 10,EU 44,US_ 11,EU 45,US_ 12,EU 47,US_ 13,EU 48","The Cloud 5 running shoes from On are a rework of a brand-signature style. Made from a more sustainable mesh fabrication, the revamped style boasts a superior fit with the same iconic CloudTec®  soles.upper: fabric lining: fabric sole: fabric insole, rubber sole almond toe lace-up Made in Vietnam comes with a box comes with extra laces Designer colour name: Storm Ohambray True to size Half sizes please take the next size up US sizes","//img.mytheresa.com/1088/1088/66/jpeg/catalog/product/90/P00704327_b1.jpg,//img.mytheresa.com/1088/1088/66/jpeg/catalog/product/90/P00704327_b2.jpg,//img.mytheresa.com/1088/1088/66/jpeg/catalog/product/90/P00704327_d1.jpg,//img.mytheresa.com/1088/1088/66/jpeg/catalog/product/90/P00704327_d2.jpg,//img.mytheresa.com/1088/1088/66/jpeg/catalog/product/90/P00704327_d3.jpg,//img.mytheresa.com/1088/1088/66/jpeg/catalog/product/90/P00704327_d4.jpg"
"Men,On,Shoes,Sneakers,Sports sneakers",https://img.mytheresa.com/1088/1088/66/jpeg/catalog/product/85/P00704376.jpg,On,Cloud 5 Waterproof running shoes,€ 155,,,P00704376,"US_ 7,EU 40,US_ 8,EU 41,US_ 9,EU 42,5,US_ 10,EU 44,US_ 11,EU 45,US_ 12,EU 47,US_ 13,EU 48","The Cloud 5 Waterproof running shoes from On are named for their entirely waterproof fabrication. The lightweight mesh uppers rest atop the brand's signature CloudTec® soles, specially designed for superior cushioning and propulsion.upper: fabric lining: fabric sole: fabric insole, rubber sole almond toe lace-up Made in Vietnam comes with a box Designer colour name: Metal/Navy True to size Half sizes please take the next size up US sizes","//img.mytheresa.com/1088/1088/66/jpeg/catalog/product/85/P00704376_b1.jpg,//img.mytheresa.com/1088/1088/66/jpeg/catalog/product/85/P00704376_b2.jpg,//img.mytheresa.com/1088/1088/66/jpeg/catalog/product/85/P00704376_d1.jpg,//img.mytheresa.com/1088/1088/66/jpeg/catalog/product/85/P00704376_d2.jpg,//img.mytheresa.com/1088/1088/66/jpeg/catalog/product/85/P00704376_d3.jpg,//img.mytheresa.com/1088/1088/66/jpeg/catalog/product/85/P00704376_d4.jpg"
"Men,New Balance,Shoes,Sneakers,Sports sneakers",https://img.mytheresa.com/1088/1088/66/jpeg/catalog/product/c3/P00749870.jpg,New Balance,Made in UK 991 sneakers,€ 195,,,P00749870,"US_ 7,EU 40,US_ 8,EU 41,5,US_ 9,EU 42,5,US_ 10,EU 44,US_ 11,EU 45,US_ 12,EU 46,5","The New Balance 991 sneakers were expertly crafted in the brand's factory in Flimby, Cumbria. They have green suede and mesh uppers with comfortable, supportive soles.upper: leather, fabric lining: fabric sole: fabric insole, rubber sole round toe lace-up Made in the UK comes with dust bag  comes with a box Designer colour name: Green Moss/Cloud Cream True to size Half sizes please take the next size down US sizes","//img.mytheresa.com/1088/1088/66/jpeg/catalog/product/c3/P00749870_b1.jpg,//img.mytheresa.com/1088/1088/66/jpeg/catalog/product/c3/P00749870_b2.jpg,//img.mytheresa.com/1088/1088/66/jpeg/catalog/product/c3/P00749870_d1.jpg,//img.mytheresa.com/1088/1088/66/jpeg/catalog/product/c3/P00749870_d2.jpg,//img.mytheresa.com/1088/1088/66/jpeg/catalog/product/c3/P00749870_d3.jpg,//img.mytheresa.com/1088/1088/66/jpeg/catalog/product/c3/P00749870_d4.jpg"
"Men,Moon Boot,Shoes,Boots,Lace up boots",https://img.mytheresa.com/1088/1088/66/jpeg/catalog/product/2c/P00711482.jpg,Moon Boot,Mtrack Tube rubber boots,€ 225,,,P00711482,"EU_ 39,EU_ 40,EU_ 41,EU_ 42,EU_ 43,EU_ 44,EU_ 45,EU_ 46","Moon Boot's MTrack Tube boots are prepared for any weather and terrain with water-repellent shells and gripped rubber soles. The tonal design has the brand's signature lacing for a secure and customizable fit.upper: rubber lining: fabric trim: fabric sole: leather insole, rubber sole round toe lace-up Made in Italy comes with a box Designer colour name: Khaki True to size Half sizes please take the next size up European sizes","//img.mytheresa.com/1088/1088/66/jpeg/catalog/product/2c/P00711482_b1.jpg,//img.mytheresa.com/1088/1088/66/jpeg/catalog/product/2c/P00711482_b2.jpg,//img.mytheresa.com/1088/1088/66/jpeg/catalog/product/2c/P00711482_d1.jpg,//img.mytheresa.com/1088/1088/66/jpeg/catalog/product/2c/P00711482_d2.jpg,//img.mytheresa.com/1088/1088/66/jpeg/catalog/product/2c/P00711482_d3.jpg,//img.mytheresa.com/1088/1088/66/jpeg/catalog/product/2c/P00711482_d4.jpg"
"Men,Valentino Garavani,Shoes,Sandals & slides",https://img.mytheresa.com/1088/1088/66/jpeg/catalog/product/80/P00635936.jpg,Valentino Garavani,Rockstud slides,€ 245,,,P00635936,"EU_ 39,EU_ 40,EU_ 41,EU_ 42,EU_ 43,EU_ 44,EU_ 45,EU_ 46","These black slides from Valentino Garavani are crafted from rubber in Italy, and are accented with the brand's iconic platinum-plated Rockstuds.trim: platinum-plated studs round open toe Made in Italy Designer colour name: Nero upper: rubber lining: rubber rubber insole and sole True to size Half sizes please take the next size up European sizes","//img.mytheresa.com/1088/1088/66/jpeg/catalog/product/80/P00635936_b1.jpg,//img.mytheresa.com/1088/1088/66/jpeg/catalog/product/80/P00635936_b2.jpg,//img.mytheresa.com/1088/1088/66/jpeg/catalog/product/80/P00635936_d1.jpg,//img.mytheresa.com/1088/1088/66/jpeg/catalog/product/80/P00635936_d2.jpg,//img.mytheresa.com/1088/1088/66/jpeg/catalog/product/80/P00635936_d3.jpg,//img.mytheresa.com/1088/1088/66/jpeg/catalog/product/80/P00635936_d4.jpg"
"Men,Maison Margiela,Shoes,Loafers",https://img.mytheresa.com/1088/1088/66/jpeg/catalog/product/e1/P00694636.jpg,Maison Margiela,Tabi leather penny loafers,€ 749,,,P00694636,"EU_ 39,EU_ 40,EU_ 41,EU_ 42,EU_ 43,EU_ 44,EU_ 45,EU_ 46","For a fresh take on classic penny loafers, look to this style from Maison Margiela. They're crafted from smooth black leather with the brand's signature Tabi split-toe design.upper: lamb leather sole: leather insole and sole round toe Made in Italy comes with dust bags comes with a box Designer colour name: Black True to size Half sizes please take the next size up European sizes","//img.mytheresa.com/1088/1088/66/jpeg/catalog/product/e1/P00694636_b1.jpg,//img.mytheresa.com/1088/1088/66/jpeg/catalog/product/e1/P00694636_b2.jpg,//img.mytheresa.com/1088/1088/66/jpeg/catalog/product/e1/P00694636_d1.jpg,//img.mytheresa.com/1088/1088/66/jpeg/catalog/product/e1/P00694636_d2.jpg,//img.mytheresa.com/1088/1088/66/jpeg/catalog/product/e1/P00694636_d3.jpg,//img.mytheresa.com/1088/1088/66/jpeg/catalog/product/e1/P00694636_d4.jpg"
"Men,Tom Ford,Shoes,Sneakers,Designer sneakers",https://img.mytheresa.com/1088/1088/66/jpeg/catalog/product/4c/P00652004.jpg,Tom Ford,Jago mesh sneakers,€ 665,,,P00652004,"UK_ 6,EU 39,UK_ 7,EU 40,UK_ 8,EU 41,UK_ 9,EU 42,UK_ 10,EU 43,UK_ 11,EU 44,UK_ 12,EU 45,UK_ 13,EU 46,UK_ 14,EU 47","Tom Ford crafts its Jago mesh sneakers from nylon and finishes them with a sock opening for optimum comfort. Built atop tonal rubber soles -engineered through an artisanal injection technique- they look ultimately sleek.upper: fabric lining: fabric sole: fabric insole, rubber sole round toe lace-up Made in Italy comes with extra laces comes with dust bags comes with a box Designer colour name: White True to size Half sizes please take the next size up UK sizes","//img.mytheresa.com/1088/1088/66/jpeg/catalog/product/4c/P00652004_b1.jpg,//img.mytheresa.com/1088/1088/66/jpeg/catalog/product/4c/P00652004_b2.jpg,//img.mytheresa.com/1088/1088/66/jpeg/catalog/product/4c/P00652004_d1.jpg,//img.mytheresa.com/1088/1088/66/jpeg/catalog/product/4c/P00652004_d2.jpg,//img.mytheresa.com/1088/1088/66/jpeg/catalog/product/4c/P00652004_d3.jpg,//img.mytheresa.com/1088/1088/66/jpeg/catalog/product/4c/P00652004_d4.jpg"
"Men,Tom Ford,Shoes,Sandals & slides",https://img.mytheresa.com/1088/1088/66/jpeg/catalog/product/ec/P00652035.jpg,Tom Ford,Harrison velvet slides,€ 465,,,P00652035,"UK_ 6,EU 39,UK_ 7,EU 40,UK_ 8,EU 41,UK_ 9,EU 42,UK_ 10,EU 43,UK_ 11,EU 44,UK_ 12,EU 45,UK_ 13,EU 46,UK_ 14,EU 47","Made in Italy, the Harrison slides from Tom Ford are made from plush velvet and feature tonal TF logo embroidery on the straps. They are set on rubber soles for a comfortable stride.upper: leather, fabric lining: fabric sole: fabric insole, rubber sole round open toe Made in Italy comes with dust bags comes with a box Designer colour name: Black Fits small to size - we recommend trying one size larger UK sizes","//img.mytheresa.com/1088/1088/66/jpeg/catalog/product/ec/P00652035_b1.jpg,//img.mytheresa.com/1088/1088/66/jpeg/catalog/product/ec/P00652035_b2.jpg,//img.mytheresa.com/1088/1088/66/jpeg/catalog/product/ec/P00652035_d1.jpg,//img.mytheresa.com/1088/1088/66/jpeg/catalog/product/ec/P00652035_d2.jpg,//img.mytheresa.com/1088/1088/66/jpeg/catalog/product/ec/P00652035_d3.jpg,//img.mytheresa.com/1088/1088/66/jpeg/catalog/product/ec/P00652035_d4.jpg"
"Men,Kenzo,Shoes,Sneakers,High-Top",https://img.mytheresa.com/1088/1088/66/jpeg/catalog/product/9c/P00675256.jpg,Kenzo,Logo high-top sneakers,€ 245,,,P00675256,"EU_ 39,EU_ 40,EU_ 41,EU_ 42,EU_ 43,EU_ 44,EU_ 45","Made from canvas with printed logos at the sides, these high-top Kenzoschool sneakers from Kenzo feature both side zip fastenings and lace-up fronts.upper: fabric, rubber lining: fabric sole: fabric insole, rubber sole round toe zipped side Made in Vietnam comes with dust bag  comes with a box Designer colour name: Cream True to size Half sizes please take the next size up European sizes","//img.mytheresa.com/1088/1088/66/jpeg/catalog/product/9c/P00675256_b1.jpg,//img.mytheresa.com/1088/1088/66/jpeg/catalog/product/9c/P00675256_b2.jpg,//img.mytheresa.com/1088/1088/66/jpeg/catalog/product/9c/P00675256_d1.jpg,//img.mytheresa.com/1088/1088/66/jpeg/catalog/product/9c/P00675256_d2.jpg,//img.mytheresa.com/1088/1088/66/jpeg/catalog/product/9c/P00675256_d3.jpg,//img.mytheresa.com/1088/1088/66/jpeg/catalog/product/9c/P00675256_d4.jpg"
"Men,Junya Watanabe,Shoes,Sneakers,Low-Top",https://img.mytheresa.com/1088/1088/66/jpeg/catalog/product/6f/P00653792.jpg,Junya Watanabe,x New Balance 574 suede sneakers,€ 239,,,P00653792,"US_ 7,EU 40,US_ 8,EU 41,5,US_ 9,EU 42,5,US_ 10,EU 44,US_ 11,EU 45","Junya Watanabe collaborates with New Balance in the making of these sneakers. Debuted on the Japanese designer's Spring/Summer 2022 runway, this iteration of the 574 trainers is made from paneled green and grey suede with branded leather heel counters and lateral N patches.upper: leather lining: fabric trim: fabric sole: fabric insole, rubber sole round toe lace-up Made in Vietnam comes with a box comes with dust bag  comes with extra laces Designer colour name: Green Fits small to size - we recommend trying one size larger US sizes","//img.mytheresa.com/1088/1088/66/jpeg/catalog/product/6f/P00653792_b1.jpg,//img.mytheresa.com/1088/1088/66/jpeg/catalog/product/6f/P00653792_b2.jpg,//img.mytheresa.com/1088/1088/66/jpeg/catalog/product/6f/P00653792_d1.jpg,//img.mytheresa.com/1088/1088/66/jpeg/catalog/product/6f/P00653792_d2.jpg,//img.mytheresa.com/1088/1088/66/jpeg/catalog/product/6f/P00653792_d3.jpg,//img.mytheresa.com/1088/1088/66/jpeg/catalog/product/6f/P00653792_d4.jpg"
"Men,Tod's,Shoes,Boots,Chelsea boots",https://img.mytheresa.com/1088/1088/66/jpeg/catalog/product/df/P00710149.jpg,Tod's,Suede desert boots,€ 499,,,P00710149,"UK_ 6,EU 39,5,UK_ 7,EU 41,UK_ 7.5,EU 41,5,UK_ 8,EU 42,UK_ 8.5,EU 42,5,UK_ 9,EU 43-43,5,UK_ 9.5,EU 44,UK_ 10,EU 44,5,UK_ 10.5,EU 45,UK_ 11,EU 45,5,UK_ 11.5,EU 46,5,UK_ 12,EU 47,UK_ 13,EU 48","Tod's presents a subtle update to its classic desert boots with this navy blue style. Crafted from supple suede, this pair features a sturdy stacked leather sole and rubber pebble detailing on the heel.upper: leather lining: leather sole: leather insole, rubber sole round toe lace-up Made in Italy comes with dust bag  comes with a box Designer colour name: Blue True to size UK sizes","//img.mytheresa.com/1088/1088/66/jpeg/catalog/product/df/P00710149_b1.jpg,//img.mytheresa.com/1088/1088/66/jpeg/catalog/product/df/P00710149_b2.jpg,//img.mytheresa.com/1088/1088/66/jpeg/catalog/product/df/P00710149_d1.jpg,//img.mytheresa.com/1088/1088/66/jpeg/catalog/product/df/P00710149_d2.jpg,//img.mytheresa.com/1088/1088/66/jpeg/catalog/product/df/P00710149_d3.jpg,//img.mytheresa.com/1088/1088/66/jpeg/catalog/product/df/P00710149_d4.jpg"
"Men,Junya Watanabe,Shoes,Sneakers,Low-Top",https://img.mytheresa.com/1088/1088/66/jpeg/catalog/product/d4/P00653788.jpg,Junya Watanabe,x New Balance 574 suede sneakers,€ 239,,,P00653788,"US_ 7,EU 40,US_ 8,EU 41,5,US_ 9,EU 42,5,US_ 10,EU 44,US_ 11,EU 45","New Balance's timeless 574 sneakers get the 	Junya Watanabe treatment by way of colorful mesh and suede inserts.upper: leather lining: fabric trim: fabric sole: fabric insole, rubber sole almond toe lace-up Made in Vietnam comes with a box comes with dust bag  comes with extra laces Designer colour name: Gray Fits small to size - we recommend trying one size larger US sizes","//img.mytheresa.com/1088/1088/66/jpeg/catalog/product/d4/P00653788_b1.jpg,//img.mytheresa.com/1088/1088/66/jpeg/catalog/product/d4/P00653788_b2.jpg,//img.mytheresa.com/1088/1088/66/jpeg/catalog/product/d4/P00653788_d1.jpg,//img.mytheresa.com/1088/1088/66/jpeg/catalog/product/d4/P00653788_d2.jpg,//img.mytheresa.com/1088/1088/66/jpeg/catalog/product/d4/P00653788_d3.jpg,//img.mytheresa.com/1088/1088/66/jpeg/catalog/product/d4/P00653788_d4.jpg"
"Men,New Balance,Shoes,Sneakers,Sports sneakers",https://img.mytheresa.com/1088/1088/66/jpeg/catalog/product/dc/P00757867.jpg,New Balance,9060 suede-trimmed sneakers,€ 135,,,P00757867,"US_ 7,EU 40,US_ 8,EU 41,5,US_ 9,EU 42,5,US_ 10,EU 44,US_ 11,EU 45,US_ 12,EU 46,5","This iteration of the 9060 sneakers from New Balance is distinguished by smooth suede detailing. Resting atop a split midsole, the cushioned design is complete with a rubber sole inspired by the classic 860 style.upper: leather, fabric lining: fabric sole: fabric insole, rubber sole almond toe lace-up Made in Vietnam comes with extra laces, comes with a box, contains non-textile parts of animal origin Designer colour name: Natural Indigo/Vintage Indigo True to size Half sizes please take the next size down US sizes","//img.mytheresa.com/1088/1088/66/jpeg/catalog/product/dc/P00757867_b1.jpg,//img.mytheresa.com/1088/1088/66/jpeg/catalog/product/dc/P00757867_b2.jpg,//img.mytheresa.com/1088/1088/66/jpeg/catalog/product/dc/P00757867_d1.jpg,//img.mytheresa.com/1088/1088/66/jpeg/catalog/product/dc/P00757867_d2.jpg,//img.mytheresa.com/1088/1088/66/jpeg/catalog/product/dc/P00757867_d3.jpg,//img.mytheresa.com/1088/1088/66/jpeg/catalog/product/dc/P00757867_d4.jpg"
"Men,Tod's,Shoes,Boots,Chelsea boots",https://img.mytheresa.com/1088/1088/66/jpeg/catalog/product/3d/P00710197.jpg,Tod's,Suede ankle boots,€ 499,,,P00710197,"UK_ 6,EU 39,5,UK_ 7,EU 41,UK_ 7.5,EU 41,5,UK_ 8,EU 42,UK_ 8.5,EU 42,5,UK_ 9,EU 43-43,5,UK_ 9.5,EU 44,UK_ 10,EU 44,5,UK_ 10.5,EU 45,UK_ 11,EU 45,5,UK_ 11.5,EU 46,5,UK_ 12,EU 47,UK_ 13,EU 48","These ankle boots from Tod's are crafted from suede, and feature elasticated inserts.upper: leather lining: leather sole: leather insole, rubber sole round toe elasticated sides Made in Italy comes with dust bag  comes with a box Designer colour name: Brown True to size UK sizes","//img.mytheresa.com/1088/1088/66/jpeg/catalog/product/3d/P00710197_b1.jpg,//img.mytheresa.com/1088/1088/66/jpeg/catalog/product/3d/P00710197_b2.jpg,//img.mytheresa.com/1088/1088/66/jpeg/catalog/product/3d/P00710197_d1.jpg,//img.mytheresa.com/1088/1088/66/jpeg/catalog/product/3d/P00710197_d2.jpg,//img.mytheresa.com/1088/1088/66/jpeg/catalog/product/3d/P00710197_d3.jpg,//img.mytheresa.com/1088/1088/66/jpeg/catalog/product/3d/P00710197_d4.jpg"
"Men,Junya Watanabe,Shoes,Sneakers,Low-Top",https://img.mytheresa.com/1088/1088/66/jpeg/catalog/product/ba/P00653787.jpg,Junya Watanabe,x New Balance 574 sneakers,€ 239,,,P00653787,"US_ 7,EU 40,US_ 8,EU 41,5,US_ 9,EU 42,5,US_ 10,EU 44,US_ 11,EU 45","Created in collaboration with New Balance, these suede sneakers from Junya Watanabe are fitted with a mesh underlay.upper: leather lining: fabric trim: fabric sole: fabric insole, rubber sole almond toe lace-up Made in Vietnam comes with a box comes with dust bag  comes with extra laces Designer colour name: Navy Fits small to size - we recommend trying one size larger US sizes","//img.mytheresa.com/1088/1088/66/jpeg/catalog/product/ba/P00653787_b1.jpg,//img.mytheresa.com/1088/1088/66/jpeg/catalog/product/ba/P00653787_b2.jpg,//img.mytheresa.com/1088/1088/66/jpeg/catalog/product/ba/P00653787_d1.jpg,//img.mytheresa.com/1088/1088/66/jpeg/catalog/product/ba/P00653787_d2.jpg,//img.mytheresa.com/1088/1088/66/jpeg/catalog/product/ba/P00653787_d3.jpg,//img.mytheresa.com/1088/1088/66/jpeg/catalog/product/ba/P00653787_d4.jpg"
