breadcrumbs,image_url,brand,product_name,listing_price,offer_price,discount,product_id,sizes,description,other_images
"Men,Christian Louboutin,Shoes,Slippers",https://img.mytheresa.com/1088/1088/66/jpeg/catalog/product/7e/P00576690.jpg,Christian Louboutin,Exclusive to Mytheresa – Navy Coolito Flat mules,€ 505,,,P00576690,"EU_ 39,EU_ 40,EU_ 41,EU_ 42,EU_ 43,EU_ 44,EU_ 45,EU_ 46,EU_ 47","Part of The Exclusive Nudes Collection with Mytheresa, Christian Louboutin designs these elegant Navy Coolito mules in dark brown suede, with a signature embroidered logo on the uppers and comfortable rubber soles.upper: leather lining: leather sole: leather insole, rubber sole round toe Made in Italy exclusive to mytheresa.com Designer colour name: Nude 8 True to size Half sizes please take the next size down European sizes","//img.mytheresa.com/1088/1088/66/jpeg/catalog/product/7e/P00576690_b1.jpg,//img.mytheresa.com/1088/1088/66/jpeg/catalog/product/7e/P00576690_b2.jpg,//img.mytheresa.com/1088/1088/66/jpeg/catalog/product/7e/P00576690_d1.jpg,//img.mytheresa.com/1088/1088/66/jpeg/catalog/product/7e/P00576690_d2.jpg,//img.mytheresa.com/1088/1088/66/jpeg/catalog/product/7e/P00576690_d3.jpg,//img.mytheresa.com/1088/1088/66/jpeg/catalog/product/7e/P00576690_d4.jpg"
"Men,Christian Louboutin,Shoes,Sneakers,Designer sneakers",https://img.mytheresa.com/1088/1088/66/jpeg/catalog/product/79/P00577975.jpg,Christian Louboutin,F.A.V Fique A Vontade sneakers,€ 559,,,P00577975,"EU_ 39,EU_ 40,EU_ 41,EU_ 42,EU_ 43,EU_ 44,EU_ 45,EU_ 46,EU_ 47","Detailed with the brands signature studs along the uppers, these blue suede sneakers from Christian Louboutin offer an elegant style, rounded toe, and logo branding on the tongue.upper: goat leather lining: leather sole: leather insole, rubber sole round toe Made in Italy Designer colour name: Elegant True to size Half sizes please take the next size up European sizes","//img.mytheresa.com/1088/1088/66/jpeg/catalog/product/79/P00577975_b1.jpg,//img.mytheresa.com/1088/1088/66/jpeg/catalog/product/79/P00577975_b2.jpg,//img.mytheresa.com/1088/1088/66/jpeg/catalog/product/79/P00577975_d1.jpg,//img.mytheresa.com/1088/1088/66/jpeg/catalog/product/79/P00577975_d2.jpg,//img.mytheresa.com/1088/1088/66/jpeg/catalog/product/79/P00577975_d3.jpg,//img.mytheresa.com/1088/1088/66/jpeg/catalog/product/79/P00577975_d4.jpg"
"Men,Christian Louboutin,Shoes,Slippers",https://img.mytheresa.com/1088/1088/66/jpeg/catalog/product/3b/P00576683.jpg,Christian Louboutin,Exclusive to Mytheresa – Navy Coolito Flat mules,€ 505,,,P00576683,"EU_ 39,EU_ 40,EU_ 41,EU_ 42,EU_ 43,EU_ 44,EU_ 45,EU_ 46,EU_ 47","Part of The Exclusive Nudes Collection with Mytheresa, Christian Louboutin designs these elegant Navy Coolito mules in brown suede, with a signature embroidered logo on the uppers and comfortable rubber soles.upper: cow leather lining: leather sole: leather insole, rubber sole round toe Made in Italy exclusive to mytheresa.com Designer colour name: Nude 6 True to size Half sizes please take the next size down European sizes","//img.mytheresa.com/1088/1088/66/jpeg/catalog/product/3b/P00576683_b1.jpg,//img.mytheresa.com/1088/1088/66/jpeg/catalog/product/3b/P00576683_b2.jpg,//img.mytheresa.com/1088/1088/66/jpeg/catalog/product/3b/P00576683_d1.jpg,//img.mytheresa.com/1088/1088/66/jpeg/catalog/product/3b/P00576683_d2.jpg,//img.mytheresa.com/1088/1088/66/jpeg/catalog/product/3b/P00576683_d3.jpg,//img.mytheresa.com/1088/1088/66/jpeg/catalog/product/3b/P00576683_d4.jpg"
"Men,Christian Louboutin,Shoes,Slippers",https://img.mytheresa.com/1088/1088/66/jpeg/catalog/product/55/P00577974.jpg,Christian Louboutin,Coolito Swing Flat mules,€ 585,,,P00577974,"EU_ 39,EU_ 40,EU_ 41,EU_ 42,EU_ 43,EU_ 44,EU_ 45,EU_ 46,EU_ 47","Christian Louboutin designs these elegant Coolito Swing mules in black leather, with a silver-tone spiked chain on the uppers and comfortable rubber soles.upper: lamb leather lining: leather trim: brass sole: leather insole, signature red leather sole round toe Made in Italy Designer colour name: Black/Silver True to size Half sizes please take the next size down European sizes","//img.mytheresa.com/1088/1088/66/jpeg/catalog/product/55/P00577974_b1.jpg,//img.mytheresa.com/1088/1088/66/jpeg/catalog/product/55/P00577974_b2.jpg,//img.mytheresa.com/1088/1088/66/jpeg/catalog/product/55/P00577974_d1.jpg,//img.mytheresa.com/1088/1088/66/jpeg/catalog/product/55/P00577974_d2.jpg,//img.mytheresa.com/1088/1088/66/jpeg/catalog/product/55/P00577974_d3.jpg,//img.mytheresa.com/1088/1088/66/jpeg/catalog/product/55/P00577974_d4.jpg"
"Men,Christian Louboutin,Shoes,Sneakers,Designer sneakers",https://img.mytheresa.com/1088/1088/66/jpeg/catalog/product/43/P00577993.jpg,Christian Louboutin,Seavaste 2 Orlato sneakers,€ 669,,,P00577993,"EU_ 39,EU_ 40,EU_ 41,EU_ 42,EU_ 43,EU_ 44,EU_ 45,EU_ 46,EU_ 47","The Seavaste 2 Orlato sneakers from Christian Louboutin feature brown suede uppers, white rubber soles, and are detailed with the label's iconic spiked details at the heel and toe cap.upper: calf leather lining: leather sole: leather insole, rubber sole round toe lace-up Made in Italy Designer colour name: Silex/Mix Corne comes with extra laces True to size Half sizes please take the next size up European sizes","//img.mytheresa.com/1088/1088/66/jpeg/catalog/product/43/P00577993_b1.jpg,//img.mytheresa.com/1088/1088/66/jpeg/catalog/product/43/P00577993_b2.jpg,//img.mytheresa.com/1088/1088/66/jpeg/catalog/product/43/P00577993_d1.jpg,//img.mytheresa.com/1088/1088/66/jpeg/catalog/product/43/P00577993_d2.jpg,//img.mytheresa.com/1088/1088/66/jpeg/catalog/product/43/P00577993_d3.jpg,//img.mytheresa.com/1088/1088/66/jpeg/catalog/product/43/P00577993_d4.jpg"
"Men,Balenciaga,Shoes,Slippers",https://img.mytheresa.com/1088/1088/66/jpeg/catalog/product/22/P00700955.jpg,Balenciaga,Pool rubber slippers,€ 395,,,P00700955,"EU_ 39,EU_ 40,EU_ 41,EU_ 42,EU_ 43,EU_ 44,EU_ 45,EU_ 46","The Pool slippers from Balenciaga have a minimalist clog-like silhouette with the brand's logo on the uppers. Crafted from rubber with molded footbeds, they're an easy slip-on-and-go style.upper: rubber lining: rubber sole: rubber insole and sole round toe Made in Italy comes with dust bags comes with a box Designer colour name: Black/White Fits large to size - we recommend trying one size smaller European sizes","//img.mytheresa.com/1088/1088/66/jpeg/catalog/product/22/P00700955_b1.jpg,//img.mytheresa.com/1088/1088/66/jpeg/catalog/product/22/P00700955_b2.jpg,//img.mytheresa.com/1088/1088/66/jpeg/catalog/product/22/P00700955_d1.jpg,//img.mytheresa.com/1088/1088/66/jpeg/catalog/product/22/P00700955_d2.jpg,//img.mytheresa.com/1088/1088/66/jpeg/catalog/product/22/P00700955_d3.jpg,//img.mytheresa.com/1088/1088/66/jpeg/catalog/product/22/P00700955_d4.jpg"
"Men,Gucci,Shoes,Loafers",https://img.mytheresa.com/1088/1088/66/jpeg/catalog/product/b8/P00674242.jpg,Gucci,GG embellished loafers,€ 699,,,P00674242,"UK_ 6,EU 40,UK_ 7,EU 41,UK_ 8,EU 42,UK_ 9,EU 43,UK_ 10,EU 44,UK_ 11,EU 45,UK_ 12,EU 46","Made from a shiny woven-effect fabric, these loafers from Gucci are embellished with GG metal logo plaques and tassel finishes.upper: leather lining: leather trim: fabric sole: leather insole and sole round toe Made in Italy comes with dust bags comes with a box Designer colour name: Dk Nat/Bla/Ner/Or-B- True to size Half sizes please take the next size up UK sizes","//img.mytheresa.com/1088/1088/66/jpeg/catalog/product/b8/P00674242_b1.jpg,//img.mytheresa.com/1088/1088/66/jpeg/catalog/product/b8/P00674242_b2.jpg,//img.mytheresa.com/1088/1088/66/jpeg/catalog/product/b8/P00674242_d1.jpg,//img.mytheresa.com/1088/1088/66/jpeg/catalog/product/b8/P00674242_d2.jpg,//img.mytheresa.com/1088/1088/66/jpeg/catalog/product/b8/P00674242_d3.jpg,//img.mytheresa.com/1088/1088/66/jpeg/catalog/product/b8/P00674242_d4.jpg"
"Men,Christian Louboutin,Shoes,Sneakers,Designer sneakers",https://img.mytheresa.com/1088/1088/66/jpeg/catalog/product/57/P00577985.jpg,Christian Louboutin,Louis Orlato Spikes sneakers,€ 839,,,P00577985,"EU_ 39,EU_ 40,EU_ 41,EU_ 42,EU_ 43,EU_ 44,EU_ 45,EU_ 46,EU_ 47","With a smooth leather finish and sleek silhouette, these off-white Louis Orlato sneakers from Christian Louboutin are Italian-made, detailed with the label's signature spike details and red rubber soles.upper: calf leather lining: leather trim: goat leather sole: leather insole, rubber sole round toe lace-up Made in Italy Designer colour name: Champagne/Silver comes with extra laces True to size Half sizes please take the next size up European sizes","//img.mytheresa.com/1088/1088/66/jpeg/catalog/product/57/P00577985_b1.jpg,//img.mytheresa.com/1088/1088/66/jpeg/catalog/product/57/P00577985_b2.jpg,//img.mytheresa.com/1088/1088/66/jpeg/catalog/product/57/P00577985_d1.jpg,//img.mytheresa.com/1088/1088/66/jpeg/catalog/product/57/P00577985_d2.jpg,//img.mytheresa.com/1088/1088/66/jpeg/catalog/product/57/P00577985_d3.jpg,//img.mytheresa.com/1088/1088/66/jpeg/catalog/product/57/P00577985_d4.jpg"
"Men,Alexander McQueen,Shoes,Sandals & slides",https://img.mytheresa.com/1088/1088/66/jpeg/catalog/product/99/P00687725.jpg,Alexander McQueen,Pool slides,€ 225,,,P00687725,"EU_ 39,EU_ 39.5,EU_ 40,EU_ 41,EU_ 42,EU_ 43,EU_ 44,EU_ 45","Made in Italy from rubber, these Alexander McQueen slides come in a stone grey colorway and have the brand's logo embossed on the uppers.upper: rubber lining: rubber sole: rubber insole and sole round open toe Made in Italy comes with dust bag  comes with a box Designer colour name: Stone 221 True to size Half sizes please take the next size up European sizes","//img.mytheresa.com/1088/1088/66/jpeg/catalog/product/99/P00687725_b1.jpg,//img.mytheresa.com/1088/1088/66/jpeg/catalog/product/99/P00687725_b2.jpg,//img.mytheresa.com/1088/1088/66/jpeg/catalog/product/99/P00687725_d1.jpg,//img.mytheresa.com/1088/1088/66/jpeg/catalog/product/99/P00687725_d2.jpg,//img.mytheresa.com/1088/1088/66/jpeg/catalog/product/99/P00687725_d3.jpg,//img.mytheresa.com/1088/1088/66/jpeg/catalog/product/99/P00687725_d4.jpg"
"Men,Balenciaga,Shoes,Sandals & slides",https://img.mytheresa.com/1088/1088/66/jpeg/catalog/product/5a/P00700992.jpg,Balenciaga,Tourist sandals,€ 550,,,P00700992,"EU_ 39,EU_ 40,EU_ 41,EU_ 42,EU_ 43,EU_ 44,EU_ 45,EU_ 46,EU_ 47",The Tourist sandals from Balenciaga are the perfect pair to explore new destinations. They're made with VELCRO® straps that ensure a secure fit for all-day wear.upper: fabric lining: fabric sole: rubber insole and sole round open toe VELCRO® fastening Made in China comes with dust bag  comes with a box Designer colour name: Black True to size Half sizes please take the next size down European sizes,"//img.mytheresa.com/1088/1088/66/jpeg/catalog/product/5a/P00700992_b1.jpg,//img.mytheresa.com/1088/1088/66/jpeg/catalog/product/5a/P00700992_b2.jpg,//img.mytheresa.com/1088/1088/66/jpeg/catalog/product/5a/P00700992_d1.jpg,//img.mytheresa.com/1088/1088/66/jpeg/catalog/product/5a/P00700992_d2.jpg,//img.mytheresa.com/1088/1088/66/jpeg/catalog/product/5a/P00700992_d3.jpg,//img.mytheresa.com/1088/1088/66/jpeg/catalog/product/5a/P00700992_d4.jpg"
"Men,Alexander McQueen,Shoes,Sneakers,Designer sneakers",https://img.mytheresa.com/1088/1088/66/jpeg/catalog/product/b6/P00687723.jpg,Alexander McQueen,Oversized suede sneakers,€ 439,,,P00687723,"EU_ 39,EU_ 39.5,EU_ 40,EU_ 40.5,EU_ 41,EU_ 41.5,EU_ 42,EU_ 42.5,EU_ 43,EU_ 43.5,EU_ 44,EU_ 44.5,EU_ 45,EU_ 45.5,EU_ 46","Alexander McQueen's classic low-top sneakers are crafted from suede with a thick rubber sole, the iconic trainers are a staple of the label offering a relaxed fit and finished with the stamped logo at the back.upper: leather lining: leather sole: leather insole, rubber sole round toe lace-up Made in Italy comes with extra laces comes with a box Designer colour name: Pa.G.M./Tr.G./D.G.M. Fits slightly small to size - we recommend trying a half size larger European sizes","//img.mytheresa.com/1088/1088/66/jpeg/catalog/product/b6/P00687723_b1.jpg,//img.mytheresa.com/1088/1088/66/jpeg/catalog/product/b6/P00687723_b2.jpg,//img.mytheresa.com/1088/1088/66/jpeg/catalog/product/b6/P00687723_d1.jpg,//img.mytheresa.com/1088/1088/66/jpeg/catalog/product/b6/P00687723_d2.jpg,//img.mytheresa.com/1088/1088/66/jpeg/catalog/product/b6/P00687723_d3.jpg,//img.mytheresa.com/1088/1088/66/jpeg/catalog/product/b6/P00687723_d4.jpg"
"Men,The North Face,Shoes,Slippers",https://img.mytheresa.com/1088/1088/66/jpeg/catalog/product/90/P00593140.jpg,The North Face,Thermoball™ Traction boots,€ 55,,,P00593140,"US_ 7,EU 40,US_ 8,EU 41,US_ 9,EU 42,US_ 10,EU 43,US_ 11,EU 44,US_ 12,EU 45,US_ 13,EU 46","These black ankle-height boots from The North Face have padded uppers with insulating synthetic down. They feature rubber soles with extra grip, and a back pull tab for easy slip-on wear.upper: fabric lining: fabric sole: fabric insole, rubber sole round toe Designer colour name: TNF Black/TNF White True to size Half sizes please take the next size up US sizes","//img.mytheresa.com/1088/1088/66/jpeg/catalog/product/90/P00593140_b1.jpg,//img.mytheresa.com/1088/1088/66/jpeg/catalog/product/90/P00593140_b2.jpg,//img.mytheresa.com/1088/1088/66/jpeg/catalog/product/90/P00593140_d1.jpg,//img.mytheresa.com/1088/1088/66/jpeg/catalog/product/90/P00593140_d2.jpg,//img.mytheresa.com/1088/1088/66/jpeg/catalog/product/90/P00593140_d3.jpg,//img.mytheresa.com/1088/1088/66/jpeg/catalog/product/90/P00593140_d4.jpg"
"Men,Dolce&Gabbana,Shoes,Sandals & slides",https://img.mytheresa.com/1088/1088/66/jpeg/catalog/product/73/P00667232.jpg,Dolce&Gabbana,Logo rubber slides,€ 175,,,P00667232,"EU_ 39,EU_ 40,EU_ 41,EU_ 42,EU_ 43,EU_ 44,EU_ 45,EU_ 46,EU_ 47",Slip into Dolce&Gabbana's quintessential beachwear styles with these rubber pool slides. They're designed with lightweight molded footbeds and flexible logo-emblazoned uppers.upper: rubber lining: rubber sole: rubber insole and sole round open toe Made in Italy comes with dust bag  comes with a box Designer colour name: Black/White True to size Half sizes please take the next size up European sizes,"//img.mytheresa.com/1088/1088/66/jpeg/catalog/product/73/P00667232_b1.jpg,//img.mytheresa.com/1088/1088/66/jpeg/catalog/product/73/P00667232_b2.jpg,//img.mytheresa.com/1088/1088/66/jpeg/catalog/product/73/P00667232_d1.jpg,//img.mytheresa.com/1088/1088/66/jpeg/catalog/product/73/P00667232_d2.jpg,//img.mytheresa.com/1088/1088/66/jpeg/catalog/product/73/P00667232_d3.jpg,//img.mytheresa.com/1088/1088/66/jpeg/catalog/product/73/P00667232_d4.jpg"
"Men,Saint Laurent,Shoes,Sandals & slides",https://img.mytheresa.com/1088/1088/66/jpeg/catalog/product/05/P00723076.jpg,Saint Laurent,Sidi leather slingback sandals,€ 585,,,P00723076,"EU_ 39,EU_ 39.5,EU_ 40,EU_ 40.5,EU_ 41,EU_ 41.5,EU_ 42,EU_ 42.5,EU_ 43,EU_ 43.5,EU_ 44,EU_ 44.5,EU_ 45,EU_ 45.5,EU_ 46","Saint Laurent's Sidi sandals are made from metal-free tanned leather. They have braided uppers and slingback straps, jute insoles, and almond-shaped toes.upper: calf leather lining: leather sole: jute insole, rubber sole round open toe Made in Italy comes with a box Designer colour name: Noir ","//img.mytheresa.com/1088/1088/66/jpeg/catalog/product/05/P00723076_d1.jpg,//img.mytheresa.com/1088/1088/66/jpeg/catalog/product/05/P00723076_d2.jpg"
"Men,Tod's,Shoes,Loafers",https://img.mytheresa.com/1088/1088/66/jpeg/catalog/product/93/P00681034.jpg,Tod's,Timeless leather loafers,€ 585,,,P00681034,"UK_ 6,EU 39,5,UK_ 7,EU 41,UK_ 7.5,EU 41,5,UK_ 8,EU 42,UK_ 8.5,EU 42,5,UK_ 9,EU 43-43,5,UK_ 9.5,EU 44,UK_ 10,EU 44,5,UK_ 10.5,EU 45,UK_ 11,EU 45,5,UK_ 12,EU 47,UK_ 13,EU 48","This pair of loafers from Tod's is a classic style with a twist. They're crafted from polished leather with the brand's iconic T-Timeless golden hardware across the vamp and are set atop chunky rubber soles.upper: leather lining: leather sole: leather insole, rubber sole round toe Made in Italy comes with dust bag  comes with a box Designer colour name: Nero Fits slightly large to size - we recommend trying a half size smaller UK sizes","//img.mytheresa.com/1088/1088/66/jpeg/catalog/product/93/P00681034_b1.jpg,//img.mytheresa.com/1088/1088/66/jpeg/catalog/product/93/P00681034_b2.jpg,//img.mytheresa.com/1088/1088/66/jpeg/catalog/product/93/P00681034_d1.jpg,//img.mytheresa.com/1088/1088/66/jpeg/catalog/product/93/P00681034_d2.jpg,//img.mytheresa.com/1088/1088/66/jpeg/catalog/product/93/P00681034_d3.jpg,//img.mytheresa.com/1088/1088/66/jpeg/catalog/product/93/P00681034_d4.jpg"
"Men,Balenciaga,Shoes,Sneakers,Low-Top",https://img.mytheresa.com/1088/1088/66/jpeg/catalog/product/22/P00721781.jpg,Balenciaga,Runner sneakers,€ 895,,,P00721781,"EU_ 39,EU_ 40,EU_ 41,EU_ 42,EU_ 43,EU_ 44,EU_ 45,EU_ 46,EU_ 47","Balenciaga's white Runner sneakers are made from panels of mesh and technical nylon. Featuring squared toes, they have logo embroidery on the tongues.upper: fabric, rubber lining: fabric sole: fabric insole, rubber sole square toe lace-up Made in Italy comes with dust bag  comes with a box Designer colour name: White True to size Half sizes please take the next size down European sizes","//img.mytheresa.com/1088/1088/66/jpeg/catalog/product/22/P00721781_b1.jpg,//img.mytheresa.com/1088/1088/66/jpeg/catalog/product/22/P00721781_b2.jpg,//img.mytheresa.com/1088/1088/66/jpeg/catalog/product/22/P00721781_d1.jpg,//img.mytheresa.com/1088/1088/66/jpeg/catalog/product/22/P00721781_d2.jpg,//img.mytheresa.com/1088/1088/66/jpeg/catalog/product/22/P00721781_d3.jpg,//img.mytheresa.com/1088/1088/66/jpeg/catalog/product/22/P00721781_d4.jpg"
"Men,Christian Louboutin,Shoes,Espadrilles",https://img.mytheresa.com/1088/1088/66/jpeg/catalog/product/5c/P00545916.jpg,Christian Louboutin,Paquepapa espadrilles,€ 419,,,P00545916,"EU_ 39,EU_ 40,EU_ 41,EU_ 42,EU_ 43,EU_ 44,EU_ 45,EU_ 46","In a suede construction, Christian Louboutin reimagines the classic espadrille silhouette in this black iteration which is accented by the label's signature red sole.upper: calf leather lining: leather sole: fabric insole, rubber sole round toe Made in Spain Designer colour name: Black True to size Half sizes please take the next size down European sizes","//img.mytheresa.com/1088/1088/66/jpeg/catalog/product/5c/P00545916_b1.jpg,//img.mytheresa.com/1088/1088/66/jpeg/catalog/product/5c/P00545916_b2.jpg,//img.mytheresa.com/1088/1088/66/jpeg/catalog/product/5c/P00545916_d1.jpg,//img.mytheresa.com/1088/1088/66/jpeg/catalog/product/5c/P00545916_d2.jpg,//img.mytheresa.com/1088/1088/66/jpeg/catalog/product/5c/P00545916_d3.jpg,//img.mytheresa.com/1088/1088/66/jpeg/catalog/product/5c/P00545916_d4.jpg"
"Men,Christian Louboutin,Shoes,Sneakers,Designer sneakers",https://img.mytheresa.com/1088/1088/66/jpeg/catalog/product/9d/P00545910.jpg,Christian Louboutin,Louis Junior Orlato sneakers,"€ 1,679",,,P00545910,"EU_ 40,EU_ 41,EU_ 42,EU_ 43,EU_ 44,EU_ 45","In a sleek silhouette, these white, low-top sneakers from Christian Louboutin are Italian-made, sporting leather uppers with silver studded embellishments, rubber soles, and the label's signature red-bottomed sole.upper: cow leather lining: leather sole: leather insole, rubber sole round toe lace-up Made in Italy Designer colour name: Version Bianco True to size Half sizes please take the next size up European sizes","//img.mytheresa.com/1088/1088/66/jpeg/catalog/product/9d/P00545910_b1.jpg,//img.mytheresa.com/1088/1088/66/jpeg/catalog/product/9d/P00545910_b2.jpg,//img.mytheresa.com/1088/1088/66/jpeg/catalog/product/9d/P00545910_d1.jpg,//img.mytheresa.com/1088/1088/66/jpeg/catalog/product/9d/P00545910_d2.jpg,//img.mytheresa.com/1088/1088/66/jpeg/catalog/product/9d/P00545910_d3.jpg,//img.mytheresa.com/1088/1088/66/jpeg/catalog/product/9d/P00545910_d4.jpg"
"Men,Givenchy,Shoes,Boots,Ankle boots",https://img.mytheresa.com/1088/1088/66/jpeg/catalog/product/56/P00550973.jpg,Givenchy,Padlock ankle boots,"€ 1,055",,,P00550973,"EU_ 39,EU_ 40,EU_ 41,EU_ 42,EU_ 43,EU_ 44,EU_ 45,EU_ 46,EU_ 47","Sporting a branded Givenchy padlock around the ankle, these black leather boots are crafted from smooth leather with a flat stacked heel and side zippers.upper: calf leather lining: leather sole: leather insole, leather and rubber sole round toe zipped side Made in Italy Designer colour name: Black True to size Half sizes please take the next size down European sizes","//img.mytheresa.com/1088/1088/66/jpeg/catalog/product/56/P00550973_b1.jpg,//img.mytheresa.com/1088/1088/66/jpeg/catalog/product/56/P00550973_b2.jpg,//img.mytheresa.com/1088/1088/66/jpeg/catalog/product/56/P00550973_d1.jpg,//img.mytheresa.com/1088/1088/66/jpeg/catalog/product/56/P00550973_d2.jpg,//img.mytheresa.com/1088/1088/66/jpeg/catalog/product/56/P00550973_d3.jpg,//img.mytheresa.com/1088/1088/66/jpeg/catalog/product/56/P00550973_d4.jpg"
"Men,Brunello Cucinelli,Shoes,Sneakers,Designer sneakers",https://img.mytheresa.com/1088/1088/66/jpeg/catalog/product/15/P00640537.jpg,Brunello Cucinelli,Suede low-top sneakers,€ 665,,,P00640537,"EU_ 39,EU_ 40,EU_ 41,EU_ 42,EU_ 43,EU_ 44,EU_ 45,EU_ 46","These low-top sneakers from Brunello Cucinelli are enriched by supple suede. Crafted in Italy, they have tonal laces and a golden logo at the heel counter.upper: calf leather lining: leather sole: leather insole, rubber sole round toe lace-up Made in Italy comes with dust bags comes with a box Designer colour name: Sabbia True to size Half sizes please take the next size down European sizes","//img.mytheresa.com/1088/1088/66/jpeg/catalog/product/15/P00640537_b1.jpg,//img.mytheresa.com/1088/1088/66/jpeg/catalog/product/15/P00640537_b2.jpg,//img.mytheresa.com/1088/1088/66/jpeg/catalog/product/15/P00640537_d1.jpg,//img.mytheresa.com/1088/1088/66/jpeg/catalog/product/15/P00640537_d2.jpg,//img.mytheresa.com/1088/1088/66/jpeg/catalog/product/15/P00640537_d3.jpg,//img.mytheresa.com/1088/1088/66/jpeg/catalog/product/15/P00640537_d4.jpg"
"Men,Berluti,Shoes,Sandals & slides",https://img.mytheresa.com/1088/1088/66/jpeg/catalog/product/3b/P00643005.jpg,Berluti,Sifnos Scritto leather slides,€ 635,,,P00643005,"UK_ 5,EU 39,UK_ 6,EU 40,UK_ 7,EU 41,UK_ 8,EU 42,UK_ 9,EU 43,UK_ 10,EU 44,UK_ 11,EU 45,UK_ 12,EU 46","Berluti's Sifnos Scritto slides are made from polished leather with dark green and black crossover straps, partially engraved with script detailing.upper: leather lining: leather sole: leather insole, rubber sole round toe Made in Italy comes with dust bags comes with a box Designer colour name: Green True to size Half sizes please take the next size up UK sizes","//img.mytheresa.com/1088/1088/66/jpeg/catalog/product/3b/P00643005_b1.jpg,//img.mytheresa.com/1088/1088/66/jpeg/catalog/product/3b/P00643005_b2.jpg,//img.mytheresa.com/1088/1088/66/jpeg/catalog/product/3b/P00643005_d1.jpg,//img.mytheresa.com/1088/1088/66/jpeg/catalog/product/3b/P00643005_d2.jpg,//img.mytheresa.com/1088/1088/66/jpeg/catalog/product/3b/P00643005_d3.jpg,//img.mytheresa.com/1088/1088/66/jpeg/catalog/product/3b/P00643005_d4.jpg"
"Men,Golden Goose,Shoes,Sneakers,Designer sneakers",https://img.mytheresa.com/1088/1088/66/jpeg/catalog/product/d1/P00550116.jpg,Golden Goose,Ball Star leather sneakers,€ 335,€ 81,,P00550116,"EU_ 39,EU_ 40,EU_ 41,EU_ 42,EU_ 43,EU_ 44,EU_ 45,EU_ 46,EU_ 47","Finished with a distressed look, these low-top sneakers from Golden Goose are made in Italy from white leather, featuring silver-toned trims, black counters, and a blue suede star on either side.upper: cow leather lining: leather, fabric trim: leather sole: leather insole, rubber sole round toe lace-up Made in Italy Designer colour name: White/Blu Storm True to size Half sizes please take the next size up European sizes","//img.mytheresa.com/1088/1088/66/jpeg/catalog/product/d1/P00550116_b1.jpg,//img.mytheresa.com/1088/1088/66/jpeg/catalog/product/d1/P00550116_b2.jpg,//img.mytheresa.com/1088/1088/66/jpeg/catalog/product/d1/P00550116_d1.jpg,//img.mytheresa.com/1088/1088/66/jpeg/catalog/product/d1/P00550116_d2.jpg,//img.mytheresa.com/1088/1088/66/jpeg/catalog/product/d1/P00550116_d3.jpg,//img.mytheresa.com/1088/1088/66/jpeg/catalog/product/d1/P00550116_d4.jpg"
"Men,Christian Louboutin,Shoes,Slippers",https://img.mytheresa.com/1088/1088/66/jpeg/catalog/product/6d/P00526325.jpg,Christian Louboutin,Roc X Tass mules,€ 766,,,P00526325,"EU_ 39,EU_ 40,EU_ 41,EU_ 42,EU_ 43,EU_ 44,EU_ 45,EU_ 46","These Roc X Tass mules from Christian Louboutin are crafted from 100% leather in baobab brown, and are detailed with studded tassels on the uppers, raw-edged vamps, and leather soles.upper: leather lining: leather sole: leather insole, signature red leather sole round toe Made in Italy Designer colour name: Baobab True to size Half sizes please take the next size down European sizes","//img.mytheresa.com/1088/1088/66/jpeg/catalog/product/6d/P00526325_b1.jpg,//img.mytheresa.com/1088/1088/66/jpeg/catalog/product/6d/P00526325_b2.jpg,//img.mytheresa.com/1088/1088/66/jpeg/catalog/product/6d/P00526325_d1.jpg,//img.mytheresa.com/1088/1088/66/jpeg/catalog/product/6d/P00526325_d2.jpg,//img.mytheresa.com/1088/1088/66/jpeg/catalog/product/6d/P00526325_d3.jpg,//img.mytheresa.com/1088/1088/66/jpeg/catalog/product/6d/P00526325_d4.jpg"
"Men,Saint Laurent,Shoes,Sandals & slides",https://img.mytheresa.com/1088/1088/66/jpeg/catalog/product/28/P00723081.jpg,Saint Laurent,Neil leather sandals,€ 505,,,P00723081,"EU_ 39,EU_ 39.5,EU_ 40,EU_ 40.5,EU_ 41,EU_ 41.5,EU_ 42,EU_ 42.5,EU_ 43,EU_ 43.5,EU_ 44,EU_ 44.5,EU_ 45,EU_ 45.5,EU_ 46","Saint Laurent's Neil sandals are made from metal-free tanned leather. Designed with braided uppers, this style has wide arch straps and cross-over toe straps.upper: leather lining: leather sole: leather insole and sole almond open toe Made in Italy comes with a box Designer colour name: Noir ","//img.mytheresa.com/1088/1088/66/jpeg/catalog/product/28/P00723081_d1.jpg,//img.mytheresa.com/1088/1088/66/jpeg/catalog/product/28/P00723081_d2.jpg"
